code_review/train/02_audit/f0_selection_bias/results/epochs/bed_simplified.csv

epoch,n_epochs,val_loss,smoke_prec,smoke_rec,smoke_f1,fire_prec,fire_rec,fire_f1,f1_macro,saved_best_f1,saved_best_loss
0,100,35.55,0.8346,0.7691,0.8005,0.8824,0.9032,0.8927,0.8466,0.8466,35.546
1,100,33.0,0.8149,0.819,0.8169,0.8723,0.946,0.9076,0.86225,0.8623,32.9967
2,100,27.1,0.9012,0.7655,0.8279,0.9186,0.9137,0.9162,0.87205,0.872,27.0979
3,100,25.99,0.8693,0.8428,0.8559,0.9108,0.9433,0.9268,0.89135,0.8913,25.9852
4,100,24.89,0.9247,0.7802,0.8463,0.9262,0.93,0.9281,0.8872,,24.8927
5,100,23.86,0.9144,0.8121,0.8602,0.8963,0.9644,0.9291,0.89465,0.8946,23.8604
6,100,25.59,0.9004,0.8378,0.868,0.8472,0.9834,0.9102,0.8891,,
7,100,21.82,0.9089,0.8635,0.8856,0.8947,0.9626,0.9274,0.9065000000000001,0.9065,21.8208
8,100,23.11,0.9089,0.8283,0.8667,0.9179,0.9528,0.935,0.90085,,
9,100,20.56,0.9472,0.814,0.8755,0.9267,0.9633,0.9447,0.9100999999999999,0.9101,20.5616
10,100,19.25,0.9216,0.867,0.8934,0.9218,0.9727,0.9466,0.9199999999999999,0.92,19.248
11,100,24.86,0.8661,0.8927,0.8792,0.8864,0.968,0.9254,0.9023,,
12,100,19.37,0.9297,0.8756,0.9019,0.9408,0.9441,0.9425,0.9222,0.9222,
13,100,20.68,0.9071,0.9091,0.9081,0.8865,0.9762,0.9292,0.91865,,
14,100,19.12,0.9232,0.9165,0.9199,0.8863,0.9849,0.933,0.92645,0.9264,19.1198
15,100,19.57,0.9121,0.9213,0.9167,0.8894,0.9811,0.933,0.92485,,
16,100,15.97,0.9275,0.9192,0.9233,0.9315,0.9673,0.949,0.93615,0.9362,15.9701
17,100,17.59,0.931,0.8877,0.9089,0.9345,0.9635,0.9488,0.92885,,
18,100,21.25,0.9107,0.917,0.9138,0.8558,0.9886,0.9174,0.9156,,
19,100,18.0,0.9059,0.9352,0.9203,0.9255,0.9584,0.9417,0.931,,
20,100,17.47,0.9207,0.9321,0.9264,0.9011,0.9784,0.9382,0.9323,,
21,100,17.19,0.9189,0.9294,0.9242,0.9057,0.9841,0.9433,0.9337500000000001,,
22,100,15.64,0.9449,0.9146,0.9295,0.9252,0.9758,0.9498,0.93965,0.9397,15.6402
23,100,17.31,0.9532,0.883,0.9168,0.9113,0.9758,0.9424,0.9296,,
24,100,16.46,0.9546,0.8891,0.9207,0.9167,0.9821,0.9483,0.9345,,
25,100,15.16,0.9511,0.8946,0.922,0.9434,0.9677,0.9554,0.9387000000000001,,15.1569
26,100,17.09,0.9296,0.9135,0.9215,0.9094,0.975,0.9411,0.9313,,
27,100,18.23,0.9184,0.9239,0.9211,0.8987,0.9855,0.9401,0.9306000000000001,,
28,100,18.31,0.9201,0.9398,0.9298,0.8763,0.9876,0.9286,0.9292,,
29,100,15.97,0.9428,0.9021,0.922,0.9253,0.9775,0.9507,0.93635,,
30,100,14.93,0.9419,0.9328,0.9373,0.9198,0.9765,0.9473,0.9423,0.9423,14.9319
31,100,14.97,0.9263,0.9373,0.9318,0.9277,0.98,0.9531,0.94245,0.9424,
32,100,15.13,0.9435,0.9266,0.935,0.9255,0.9744,0.9493,0.94215,,
33,100,16.09,0.9169,0.9403,0.9284,0.9248,0.9774,0.9504,0.9394,,
34,100,14.92,0.9316,0.932,0.9318,0.9254,0.9843,0.9539,0.94285,0.9429,14.9166
35,100,14.71,0.9603,0.9123,0.9357,0.91,0.9874,0.9471,0.9414,,14.7089
36,100,12.91,0.9466,0.9317,0.9391,0.9453,0.9811,0.9628,0.95095,0.951,12.9127
37,100,16.02,0.9331,0.9305,0.9318,0.9101,0.9838,0.9455,0.93865,,
38,100,16.65,0.9532,0.893,0.9221,0.9202,0.982,0.9501,0.9360999999999999,,
39,100,13.86,0.9549,0.9232,0.9388,0.9203,0.9859,0.952,0.9454,,
40,100,13.06,0.9428,0.9385,0.9406,0.9353,0.985,0.9595,0.9500500000000001,,
41,100,15.14,0.9366,0.9367,0.9366,0.9146,0.9874,0.9496,0.9431,,
42,100,16.1,0.9239,0.9424,0.9331,0.9048,0.9882,0.9446,0.93885,,
43,100,15.15,0.9507,0.9264,0.9384,0.9139,0.9816,0.9466,0.9425,,
44,100,17.43,0.9168,0.948,0.9322,0.8992,0.9886,0.9418,0.937,,
45,100,12.45,0.9519,0.9347,0.9432,0.9468,0.9772,0.9617,0.95245,0.9525,12.4452
46,100,13.24,0.9445,0.9373,0.9409,0.9306,0.986,0.9575,0.9492,,
47,100,13.31,0.936,0.9477,0.9418,0.9375,0.9821,0.9593,0.95055,,
48,100,12.19,0.9575,0.935,0.9461,0.9435,0.9821,0.9624,0.95425,0.9543,12.1943
49,100,14.93,0.9443,0.9362,0.9403,0.9112,0.9857,0.947,0.94365,,
50,100,12.08,0.9593,0.9323,0.9456,0.9413,0.9821,0.9613,0.95345,,12.0835
51,100,15.03,0.9309,0.9504,0.9405,0.9094,0.9857,0.946,0.9432499999999999,,
52,100,13.09,0.963,0.9283,0.9453,0.9284,0.9871,0.9568,0.95105,,
53,100,14.19,0.9406,0.9369,0.9388,0.9228,0.9855,0.9531,0.94595,,
54,100,13.12,0.9539,0.9348,0.9443,0.9282,0.984,0.9553,0.9498,,
55,100,12.35,0.9563,0.9362,0.9462,0.9384,0.9853,0.9613,0.9537500000000001,,
56,100,12.51,0.9529,0.934,0.9434,0.9392,0.9815,0.9599,0.95165,,
57,100,13.73,0.9417,0.9478,0.9447,0.9197,0.9905,0.9538,0.9492499999999999,,
58,100,11.82,0.9612,0.9267,0.9436,0.9567,0.9725,0.9645,0.9540500000000001,,11.8249
59,100,12.7,0.9571,0.9321,0.9445,0.9364,0.9862,0.9606,0.95255,,
60,100,13.57,0.9372,0.9457,0.9414,0.9349,0.9834,0.9585,0.9499500000000001,,
61,100,16.68,0.9245,0.9554,0.9397,0.8917,0.9901,0.9383,0.9390000000000001,,
62,100,11.08,0.9514,0.9481,0.9498,0.9539,0.9826,0.9681,0.95895,0.9589,11.0786
63,100,12.02,0.9468,0.9488,0.9478,0.9485,0.9792,0.9636,0.9557,,
64,100,12.06,0.9576,0.9406,0.949,0.9405,0.9811,0.9604,0.9547,,
65,100,11.6,0.9623,0.935,0.9485,0.9483,0.9834,0.9655,0.9570000000000001,,
66,100,12.73,0.9541,0.9394,0.9467,0.9319,0.9883,0.9593,0.9530000000000001,,
67,100,12.66,0.9502,0.9434,0.9468,0.9346,0.9858,0.9595,0.9531499999999999,,
68,100,13.98,0.9441,0.9497,0.9469,0.9154,0.9905,0.9514,0.9491499999999999,,
69,100,12.68,0.9497,0.9472,0.9485,0.9292,0.9883,0.9578,0.9531499999999999,,
70,100,12.1,0.9513,0.9457,0.9485,0.9381,0.9874,0.9621,0.9553,,
71,100,11.7,0.9566,0.9455,0.951,0.9426,0.9849,0.9633,0.95715,,
72,100,12.83,0.9458,0.9471,0.9464,0.9388,0.9877,0.9626,0.9545,,
73,100,13.58,0.9499,0.9465,0.9482,0.9216,0.9876,0.9535,0.95085,,
74,100,12.88,0.9521,0.9488,0.9505,0.9303,0.9853,0.957,0.95375,,
75,100,13.19,0.9485,0.9518,0.9502,0.9236,0.9869,0.9542,0.9522,,
76,100,12.14,0.9487,0.951,0.9499,0.9391,0.9871,0.9625,0.9561999999999999,,
77,100,12.4,0.9529,0.9525,0.9527,0.9293,0.988,0.9577,0.9552,,
78,100,12.2,0.9545,0.9471,0.9507,0.932,0.9877,0.959,0.95485,,
79,100,11.94,0.9556,0.9471,0.9513,0.9368,0.9876,0.9615,0.9564,,
80,100,11.5,0.9576,0.9467,0.9521,0.94,0.986,0.9625,0.9573,,
81,100,13.21,0.9477,0.9504,0.949,0.9265,0.9878,0.9562,0.9526,,
82,100,12.53,0.9508,0.9478,0.9493,0.9344,0.9869,0.96,0.95465,,
83,100,12.3,0.9578,0.9441,0.9509,0.932,0.9877,0.959,0.95495,,
84,100,12.06,0.9509,0.9485,0.9497,0.9445,0.9847,0.9642,0.95695,,
85,100,13.31,0.9449,0.9552,0.95,0.926,0.9877,0.9559,0.95295,,
86,100,12.77,0.9538,0.9444,0.9491,0.9298,0.9883,0.9582,0.9536500000000001,,
87,100,12.68,0.9539,0.9463,0.9501,0.9262,0.9878,0.956,0.95305,,
88,100,12.67,0.9539,0.9461,0.95,0.9293,0.9882,0.9578,0.9539,,
89,100,12.01,0.9528,0.9506,0.9517,0.9395,0.9871,0.9627,0.9572,,
90,100,11.78,0.9499,0.9529,0.9514,0.9433,0.985,0.9637,0.95755,,
91,100,12.55,0.9556,0.9482,0.9519,0.9298,0.9885,0.9583,0.9551000000000001,,
92,100,13.16,0.9498,0.9498,0.9498,0.9264,0.9885,0.9564,0.9531000000000001,,
93,100,12.08,0.9575,0.9474,0.9524,0.9344,0.9872,0.9601,0.95625,,
94,100,13.05,0.9529,0.9468,0.9498,0.9248,0.9891,0.9559,0.95285,,
95,100,12.81,0.9515,0.9496,0.9505,0.9275,0.9878,0.9567,0.9536,,
96,100,12.21,0.9543,0.9476,0.9509,0.9355,0.9874,0.9608,0.95585,,
97,100,11.77,0.957,0.9476,0.9523,0.9389,0.9869,0.9623,0.9573,,
98,100,12.7,0.9504,0.9526,0.9515,0.9301,0.9885,0.9584,0.95495,,
99,100,12.12,0.9529,0.9504,0.9517,0.9393,0.9857,0.9619,0.9568,,

paper_files/paper.md

#### 1) DFire and FASDD

The resulting dataset comprises 141,938 images, with 82.8% used for training and 17.2% for testing, as detailed in Table 1. The original training and test assignments provided by each source dataset are preserved. This facilitates reconstruction of the combined split, although it does not guarantee independence between images originating from different datasets. FASDD provides explicit information about the origin of its images and does not include DFire among its listed sources. However, both datasets are partially based on images collected from the internet, where content reuse is common and difficult to fully trace. As a result, strict independence between datasets cannot be guaranteed, and the presence of overlapping or near-duplicate samples cannot be ruled out. This limitation may lead to optimistic performance estimates and therefore the reported results should be interpreted with caution in terms of generalization.

#### 5) Further Optimizations

We next examine two additional modifications to MobileNetV2 Nano. The 4-bit input configuration in Table 5 reduces F1-Macro to 94.44% without providing a sufficient implementation benefit, while reducing the first convolution does not materially improve the observed hardware–accuracy trade-off. We therefore evaluate input-resolution scaling and removal of all-zero convolutional channels:

#### 1) Reference Models

<!-- In the PDF, the whole "BED FPGA" label is bold and the F1-Macro value 94.54 % is bold. -->

#### 3) MobileNetV2 Optimization

Among the compact architectures in Table 5, MobileNetV2 Nano achieves the highest FP32 F1-Macro at 95.93%. Adding ECA changes the score by −0.10 percentage points, whereas the standard width-multiplier configuration and MobileNetV3 Mini score 2.71 and 0.56 points lower, respectively. After quantization, replacing ReLU with ReLU6 reduces F1-Macro from 95.45% to 94.19%, and using a 4-bit input reduces it to 94.44%. We therefore retain ReLU and 8-bit input quantization. Spatial SVD and channel pruning are not applied to this architecture because its channel counts are already aligned with FPGA folding requirements, while its skip connections complicate graph-consistent channel removal.